{
  "schemaVersion": 1,
  "blueprintVersion": "v1.1",
  "sourcePdf": "200-901-CCNAAUTO_v.1.1.pdf",
  "notes": "Script fill-in and Ansible playbook coding exercises under CCNAAUTO_Coding/.",
  "assignments": {
    "dragdrop-curl-oauth-json-retrieve-resource.html": {
      "objectives": ["2.7"],
      "subObjectives": [],
      "verification": {
        "verifiedAt": "2026-06-28",
        "sources": [
          {
            "type": "cisco-devnet",
            "title": "API Quick Start - Cisco Catalyst Center API",
            "url": "https://developer.cisco.com/docs/catalyst-center/2-3-7-9/api-quick-start/"
          },
          {
            "type": "cisco-devnet",
            "title": "Cisco Network Management as a Service API",
            "url": "https://developer.cisco.com/docs/cisco-nmas-api/"
          }
        ]
      }
    },
    "dragdrop-dna-center-network-device-python-get.html": {
      "objectives": ["5.7"],
      "subObjectives": [],
      "verification": {
        "verifiedAt": "2026-06-28",
        "sources": [
          {
            "type": "cisco-devnet",
            "title": "Devices - Cisco Catalyst Center API",
            "url": "https://developer.cisco.com/docs/catalyst-center/devices/"
          },
          {
            "type": "cisco-devnet",
            "title": "API Quick Start - Cisco Catalyst Center API",
            "url": "https://developer.cisco.com/docs/catalyst-center/2-3-7-9/api-quick-start/"
          }
        ]
      }
    }
  }
}
