{
  "schemaVersion": 1,
  "blueprintVersion": "v1.1",
  "sourcePdf": "200-901-CCNAAUTO_v.1.1.pdf",
  "notes": "Match/classification drag-and-drop slugs under CCNAAUTO_D_D/. Script fill-ins live in ccnaauto-coding-topic-map.json.",
  "assignments": {
    "dragdrop-network-components-to-descriptions-unused.html": {
      "objectives": ["4.9"],
      "subObjectives": [],
      "verification": {
        "verifiedAt": "2026-06-28",
        "sources": [
          {
            "type": "cisco-devnet",
            "title": "Introduction - Application Hosting on Cisco Catalyst Switches",
            "url": "https://developer.cisco.com/docs/app-hosting/introduction/"
          },
          {
            "type": "cisco-devnet",
            "title": "Create Reverse Proxy Mappings - Cisco Catalyst SD-WAN Manager API",
            "url": "https://developer.cisco.com/docs/sdwan/20-16/create-reverse-proxy-mappings/"
          },
          {
            "type": "cisco-doc",
            "title": "Configuring DNS",
            "url": "https://www.cisco.com/c/en/us/td/docs/ios-xml/ios/ipaddr_dns/configuration/xe-16-6/ipaddr-dns-xe-16-6-book/ipaddr-dns-config-dns.html"
          }
        ]
      }
    }
  }
}
